{
  "package_version": "v1.0",
  "manifest_version": 1,
  "contract_version": 1,
  "request_id": "basiclit_windows_vulkan_high_20260304_001",
  "target": {
    "platform": "windows",
    "graphics_api": "vulkan",
    "arch": "x86_64"
  },
  "quality": "high",
  "hashes": {
    "request_hash": "9CC9434D24B93F47A3B4B19A94C8CDD5",
    "result_hash": "21A0EA4A489DC44F90082DB6708888C9",
    "content_hash": "A51D9B4B59D6492E8E8D4AA7F66D1C4E"
  },
  "generator": {
    "name": "shadergen-cli",
    "version": "0.1.0",
    "build_time_utc": "2026-03-04T08:30:00Z",
    "toolchain": "msvc-14.50",
    "host": "windows-x64"
  },
  "artifacts": [
    {
      "path": "manifest.json",
      "kind": "manifest",
      "size": 1342,
      "hash": "B5B2A5F0A0C1446797A8A9C4B6A1D2E3"
    },
    {
      "path": "materials/basiclit/layout.json",
      "kind": "layout",
      "material_key": "basiclit",
      "size": 842,
      "hash": "E1B1223C0A9C4D9982A9B1C3D4E5F607"
    },
    {
      "path": "materials/basiclit/vertex.json",
      "kind": "vertex",
      "material_key": "basiclit",
      "size": 512,
      "hash": "A1B2C3D4E5F6070899AABBCCDDEEFF11"
    },
    {
      "path": "materials/basiclit/spv_stage_0x1.spv",
      "kind": "spv",
      "material_key": "basiclit",
      "stage_mask": 1,
      "size": 4096,
      "hash": "0E1D2C3B4A59687766554433221100FF"
    },
    {
      "path": "materials/basiclit/spv_stage_0x10.spv",
      "kind": "spv",
      "material_key": "basiclit",
      "stage_mask": 16,
      "size": 7168,
      "hash": "8F7E6D5C4B3A29100112233445566778"
    }
  ],
  "signature": {
    "algorithm": "none",
    "value": "N/A"
  },
  "metadata": {
    "notes": "example manifest for Task B"
  }
}
